{
  "asset_id": "test.calibration.walking-character",
  "canonical_path": "registry/assets/test_calibration_walking_character.rgba",
  "sha256": "78ad9a170ac0ba06eb4756f9c9c19923e754e82c22025dab7dfbc46de5c1b790",
  "license": "CC0-1.0",
  "source_type": "project_synthetic",
  "creator": "SuperRTP Project",
  "creation_tool": "tools/generate_calibration_charset.py",
  "clean_room_attestation": {
    "proprietary_rtp_derived": false,
    "openrtp_derived": false,
    "external_art_used": false,
    "ai_generation_used": false,
    "geometric_primitives_only": true,
    "notes": "Generated exclusively from mathematical polygon coordinates, directional arrows, and step indicators using Python standard library struct/zlib."
  },
  "specification": {
    "rpg_engine": "RPG Maker 2000 / EasyRPG Player",
    "asset_class": "CharSet",
    "notes": "Test-only compatibility calibration fixture for Phase 1 vertical slice."
  },
  "test_only": true
}
